http://purl.obolibrary.org/obo/OBIB_0000581,clinical history of an unexplained cough or shortness of breath,http://purl.obolibrary.org/obo/OGMS_0000015,clinical history,,A clinical history in which there is are active signs of unexplained persistent cough and/or shortness of breath.
http://purl.obolibrary.org/obo/OBIB_0000582,clinical history of opportunistic infections,http://purl.obolibrary.org/obo/OGMS_0000015,clinical history,,A clinical history in which there is a history of opportunistic infections.
http://purl.obolibrary.org/obo/OBIB_0000583,clinical history of sexually transmitted disease,http://purl.obolibrary.org/obo/OGMS_0000015,clinical history,,A clinical history in which there is a history of sexually transmitted diseases
http://purl.obolibrary.org/obo/OBIB_0000584,clinical history of drug abuse,http://purl.obolibrary.org/obo/OGMS_0000015,clinical history,,A clinical history in which there is a history of drug abuse.
http://purl.obolibrary.org/obo/OBIB_0000585,clinical history of Severe Acute Respiratory Syndrome,http://purl.obolibrary.org/obo/OGMS_0000015,clinical history,,A clinical history in which there is a history of a Severe Acute Respiratory Syndrome (SARS) diagnosis.
http://purl.obolibrary.org/obo/OBIB_0000586,clinical history of exposure to Severe Acute Respiratory Syndrome,http://purl.obolibrary.org/obo/OGMS_0000015,clinical history,,A clinical history in which there is a history of recent contact with someone who has Severe Acute Respiratory Syndrome (SARS).
http://purl.obolibrary.org/obo/OBIB_0000587,clinical history of West Nile Virus,http://purl.obolibrary.org/obo/OGMS_0000015,clinical history,,A clinical history in which there is a history of West Nile Virus (WNV) infection.
http://purl.obolibrary.org/obo/OBIB_0000588,clinical history of West Nile Virus exposure,http://purl.obolibrary.org/obo/OGMS_0000015,clinical history,,A clinical history in which there is a history of contact with a human or animal who has West Nile Virus (WNV).
http://purl.obolibrary.org/obo/OBIB_0000589,clinical history of gonorrhea,http://purl.obolibrary.org/obo/OGMS_0000015,clinical history,,A clinical history in which there is a history of active gonorrhea infection or treatment for gonorrhea in the recent past.
http://purl.obolibrary.org/obo/OBIB_0000590,clinical history of syphilis,http://purl.obolibrary.org/obo/OGMS_0000015,clinical history,,A clinical history in which there is a history of active syphilis infection or treatment for syphilis in the recent past.
http://purl.obolibrary.org/obo/OBIB_0000591,clinical history of Hepatitis B,http://purl.obolibrary.org/obo/OGMS_0000015,clinical history,,A clinical history in which there is a history of Hepatitis B infection.
http://purl.obolibrary.org/obo/OBIB_0000592,clinical history of Hepatitis C,http://purl.obolibrary.org/obo/OGMS_0000015,clinical history,,A clinical history in which there is a history of Hepatitis C infection.
http://purl.obolibrary.org/obo/OBIB_0000593,clinical history of Human Immunodeficiency Virus,http://purl.obolibrary.org/obo/OGMS_0000015,clinical history,,A clinical history in which there is a history of Human Immunodeficiency Virus (HIV).
http://purl.obolibrary.org/obo/OBIB_0000594,clinical history of lupus,http://purl.obolibrary.org/obo/OGMS_0000015,clinical history,,A clinical history in which there is a history of systemic lupus
http://purl.obolibrary.org/obo/OBIB_0000595,clinical history of sarcoidosis,http://purl.obolibrary.org/obo/OGMS_0000015,clinical history,,A clinical history in which there is a history of sarcoidosis.
http://purl.obolibrary.org/obo/OBIB_0000596,clinical history of scleroderma,http://purl.obolibrary.org/obo/OGMS_0000015,clinical history,,A clinical history in which there is a history of scleroderma.
http://purl.obolibrary.org/obo/OBIB_0000597,clinical history of Reye's Syndrome,http://purl.obolibrary.org/obo/OGMS_0000015,clinical history,,A clinical history in which there is a history of Reye's Syndrome.
http://purl.obolibrary.org/obo/OBIB_0000598,clinical history of rheumatoid arthritis,http://purl.obolibrary.org/obo/OGMS_0000015,clinical history,,A clinical history in which there is a history of rheumatoid arthritis.
http://purl.obolibrary.org/obo/OBIB_0000599,clinical history of idiopathic heart disease,http://purl.obolibrary.org/obo/OGMS_0000015,clinical history,,A clinical history in which there is a history of idiopathic heart disease.
http://purl.obolibrary.org/obo/OBIB_0000600,clinical history of Alzheimer's disease,http://purl.obolibrary.org/obo/OGMS_0000015,clinical history,,A clinical history in which there is a history of Alzheimer's Disease.
http://purl.obolibrary.org/obo/OBIB_0000601,clinical history of dementia of unknown cause,http://purl.obolibrary.org/obo/OGMS_0000015,clinical history,,"A clinical history in which there is a history of dementia with unknown cause  that is not caused by a previous Cerebrovascular Accident (CVA) infection, head trauma or brain tumor)."
http://purl.obolibrary.org/obo/OBIB_0000602,clinical history of Multiple Sclerosis,http://purl.obolibrary.org/obo/OGMS_0000015,clinical history,,A clinical history in which there is a history of Multiple Sclerosis (MS).
http://purl.obolibrary.org/obo/OBIB_0000603,clinical history of Amyotrophic Lateral Sclerosis,http://purl.obolibrary.org/obo/OGMS_0000015,clinical history,,A clinical history in which there is a history of Amyotrophic Lateral Sclerosis (ALS)
http://purl.obolibrary.org/obo/OBIB_0000604,indication of having resided in a Northern European military base,http://purl.obolibrary.org/obo/IAO_0000030,information content entity,,An information content entity in which there is an indication of whether an individual resided on a Northern European military base for a specified duration during a specific time frame.
http://purl.obolibrary.org/obo/OBIB_0000605,indication of having resided in Europe during a specific time frame,http://purl.obolibrary.org/obo/IAO_0000030,information content entity,,An information content entity in which there is an indication of whether an individual resided in Europe during a specific time frame
http://purl.obolibrary.org/obo/OBIB_0000606,indication of performing sexual acts in exchange for money or drugs,http://purl.obolibrary.org/obo/IAO_0000030,information content entity,,An information content entity in which there is an indication of whether an individual ever performed sexual acts in exchange for money or drugs.
http://purl.obolibrary.org/obo/OBIB_0000608,indication of a tattoo from unregulated tattoo parlor,http://purl.obolibrary.org/obo/IAO_0000030,information content entity,,"An information content entity in which there is an indication of whether an individual had a tattoo done in a state that does not regulate tattoo parlors, in the recent past."
http://purl.obolibrary.org/obo/OBIB_0000609,indication of illegal prescription drug use,http://purl.obolibrary.org/obo/IAO_0000030,information content entity,,An information content entity in which there is an indication of whether an individual has used prescription pills that were not prescribed to them.
http://purl.obolibrary.org/obo/OBIB_0000610,indication of intravenous drug use,http://purl.obolibrary.org/obo/IAO_0000030,information content entity,,An information content entity in which there is an indication of whether an individual has used illegal intravenous drugs  in a specified time frame.
http://purl.obolibrary.org/obo/OBIB_0000611,indication of having lived in the United Kingdom during specific time frame,http://purl.obolibrary.org/obo/IAO_0000030,information content entity,,"An information content entity in which there is an indication of whether an individual spent a total of three or more months in the United Kingdom, in a specified time frame."
http://purl.obolibrary.org/obo/OBIB_0000612,indication of body piercing from non-professional,http://purl.obolibrary.org/obo/IAO_0000030,information content entity,,An information content entity in which there is an indication of whether an individual has signs of non-professional  body piercing.
http://purl.obolibrary.org/obo/OBIB_0000613,indication of tattoo from non-professional,http://purl.obolibrary.org/obo/IAO_0000030,information content entity,,An information content entity in which there is an indication of whether an individual has signs of non-professional  tattoos.
http://purl.obolibrary.org/obo/OBIB_0000614,indication of residence in state-run group home at time of death,http://purl.obolibrary.org/obo/IAO_0000030,information content entity,,An information content entity in which there is an indication of whether an individual was a resident of a state-run group home at time of death.
http://purl.obolibrary.org/obo/OBIB_0000615,indication of having resided in Europe during specific time frame,http://purl.obolibrary.org/obo/IAO_0000030,information content entity,,An information content entity in which there is an indication of whether an individual lived in Europe for at least 5 years during a specific time.
http://purl.obolibrary.org/obo/CHEBI_35482,opioid analgesic,http://purl.obolibrary.org/obo/OBIB_0000026,medication role,,"A narcotic or opioid substance, synthetic or semisynthetic agent producing profound analgesia, drowsiness, and changes in mood."
http://purl.obolibrary.org/obo/CHEBI_16991,deoxyribonucleic acid,http://purl.obolibrary.org/obo/CHEBI_33696,nucleic acid,,"High molecular weight, linear polymers, composed of nucleotides containing deoxyribose and linked by phosphodiester bonds; DNA contain the genetic information of organisms."
http://purl.obolibrary.org/obo/CHEBI_33696,nucleic acid,http://purl.obolibrary.org/obo/CHEBI_33839,macromolecule,,"A macromolecule made up of nucleotide units and hydrolysable into certain pyrimidine or purine bases (usually adenine, cytosine, guanine, thymine, uracil), D-ribose or 2-deoxy-D-ribose and phosphoric acid."
http://purl.obolibrary.org/obo/CHEBI_51371,muscle relaxant,http://purl.obolibrary.org/obo/OBIB_0000026,medication role,,"A drug used to produce muscle relaxation (excepting neuromuscular blocking agents). Its primary clinical and therapeutic use is the treatment of muscle spasm and immobility associated with strains, sprains, and injuries of the back and, to a lesser degree, injuries to the neck. Also used for the treatment of a variety of clinical conditions that have in common only the presence of skeletal muscle hyperactivity, for example, the muscle spasms that can occur in multiple sclerosis."
http://purl.obolibrary.org/obo/CL_0000000,cell,http://purl.obolibrary.org/obo/BFO_0000040,material entity,,A material entity of anatomical origin (part of or deriving from an organism) that has as its parts a maximally connected cell compartment surrounded by a plasma membrane.
http://purl.obolibrary.org/obo/CL_0000001,primary cultured cell,http://purl.obolibrary.org/obo/CL_0000010,cultured cell,,"A cultured cell that is freshly isolated from a organismal source, or derives in culture from such a cell prior to the culture being passaged."
http://purl.obolibrary.org/obo/CL_0000010,cultured cell,http://purl.obolibrary.org/obo/CL_0000578,experimentally modified cell in vitro,,A cell in vitro that is or has been maintained or propagated as part of a cell culture.
http://purl.obolibrary.org/obo/CL_0000232,erythrocyte,http://purl.obolibrary.org/obo/CL_0000000,cell,,"A red blood cell. In mammals, mature erythrocytes are biconcave disks containing hemoglobin whose function is to transport oxygen."
http://purl.obolibrary.org/obo/CL_0000558,reticulocyte,http://purl.obolibrary.org/obo/CL_0000000,cell,,An immature erythrocyte that changes the protein composition of its plasma membrane by exosome formation and extrusion. The types of protein removed differ between species though removal of the transferrin receptor is apparent in mammals and birds.
http://purl.obolibrary.org/obo/CL_0000578,experimentally modified cell in vitro,http://purl.obolibrary.org/obo/CL_0000000,cell,,A cell in vitro that has undergone physical changes as a consequence of a deliberate and specific experimental procedure.
http://purl.obolibrary.org/obo/CL_0000738,leukocyte,http://purl.obolibrary.org/obo/CL_0000000,cell,,"An achromatic cell of the myeloid or lymphoid lineages capable of ameboid movement, found in blood or other tissue."
http://purl.obolibrary.org/obo/DOID_0050687,cell type cancer,http://purl.obolibrary.org/obo/DOID_162,cancer,,A cancer that is classified by the type of cell from which it is derived.
http://purl.obolibrary.org/obo/DOID_0050917,lung combined type small cell adenocarcinoma,http://purl.obolibrary.org/obo/DOID_3905,lung carcinoma,,A lung combined type small cell carcinoma that has_material_basis_in epithelial tissue of glandular origin.
http://purl.obolibrary.org/obo/DOID_0050933,ovarian serous carcinoma,http://purl.obolibrary.org/obo/DOID_2394,ovarian cancer,,An ovarian carcinoma that has_material_basis_in the lining of the ovary and produces a serum-like fluid.
http://purl.obolibrary.org/obo/DOID_769,neuroblastoma,http://purl.obolibrary.org/obo/DOID_162,cancer,,An autonomic nervous system neoplasm that derives_from immature nerve cells.
http://purl.obolibrary.org/obo/UBERON_0000007,pituitary gland,http://purl.obolibrary.org/obo/UBERON_0000465,material anatomical entity,,The pituitary gland is an endocrine gland that secretes hormones that regulate many other glands [GO]. An endocrine gland located ventral to the diencephalon and derived from mixed neuroectodermal and non neuroectodermal origin [ZFIN].
http://purl.obolibrary.org/obo/UBERON_0000029,lymph node,http://purl.obolibrary.org/obo/UBERON_0000465,material anatomical entity,,"Any of the rounded masses of lymphoid tissue that are surrounded by a capsule of connective tissue, are distributed along the lymphatic vessels, and contain numerous lymphocytes which filter the flow of lymph."
http://purl.obolibrary.org/obo/UBERON_0000059,large intestine,http://purl.obolibrary.org/obo/UBERON_0000064,organ part,,A subdivision of the digestive tract that connects the small intestine to the cloaca or anus. Lacks or has few villi[Kardong].
http://purl.obolibrary.org/obo/UBERON_0000165,mouth,http://purl.obolibrary.org/obo/UBERON_0000465,material anatomical entity,,"The proximal portion of the digestive tract, containing the oral cavity and bounded by the oral opening. In vertebrates, this extends to the pharynx and includes gums, lips, tongue and parts of the palate. Typically also includes the teeth, except where these occur elsewhere (e.g. pharyngeal jaws) or protrude from the mouth (tusks)."
http://purl.obolibrary.org/obo/UBERON_0000178,blood,http://purl.obolibrary.org/obo/UBERON_0006314,bodily fluid,,A fluid that is composed of blood plasma and erythrocytes.
http://purl.obolibrary.org/obo/UBERON_0000945,stomach,http://purl.obolibrary.org/obo/UBERON_0000465,material anatomical entity,,"An expanded region of the vertebrate alimentary tract that serves as a food storage compartment and digestive organ. A stomach is lined, in whole or in part by a glandular epithelium."
http://purl.obolibrary.org/obo/UBERON_0000948,heart,http://purl.obolibrary.org/obo/UBERON_0000465,material anatomical entity,,A myogenic muscular circulatory organ found in the vertebrate cardiovascular system composed of chambers of cardiac muscle. It is the primary circulatory organ.
http://purl.obolibrary.org/obo/UBERON_0000955,brain,http://purl.obolibrary.org/obo/UBERON_0000465,material anatomical entity,,"The brain is the center of the nervous system in all vertebrate, and most invertebrate, animals. Some primitive animals such as jellyfish and starfish have a decentralized nervous system without a brain, while sponges lack any nervous system at all. In vertebrates, the brain is located in the head, protected by the skull and close to the primary sensory apparatus of vision, hearing, balance, taste, and smell[WP]."
http://purl.obolibrary.org/obo/UBERON_0000970,eye,http://purl.obolibrary.org/obo/UBERON_0000465,material anatomical entity,,An organ that detects light.
http://purl.obolibrary.org/obo/UBERON_0000990,reproductive system,http://purl.obolibrary.org/obo/UBERON_0000465,material anatomical entity,,Anatomical system that has as its parts the organs concerned with reproduction.
http://purl.obolibrary.org/obo/UBERON_0000995,uterus,http://purl.obolibrary.org/obo/UBERON_0000064,organ part,,the female muscular organ of gestation in which the developing embryo or fetus is nourished until birth
http://purl.obolibrary.org/obo/UBERON_0000996,vagina,http://purl.obolibrary.org/obo/UBERON_0000064,organ part,,"A fibromuscular tubular tract leading from the uterus to the exterior of the body in female placental mammals and marsupials, or to the cloaca in female birds, monotremes, and some reptiles[WP]."
http://purl.obolibrary.org/obo/UBERON_0001004,respiratory system,http://purl.obolibrary.org/obo/UBERON_0000465,material anatomical entity,,Functional system which consists of structures involved in respiration.
http://purl.obolibrary.org/obo/UBERON_0001134,skeletal muscle tissue,http://purl.obolibrary.org/obo/UBERON_0000479,tissue,,Muscle tissue that consists primarily of skeletal muscle fibers.
http://purl.obolibrary.org/obo/UBERON_0001155,colon,http://purl.obolibrary.org/obo/UBERON_0000465,material anatomical entity,,Last portion of the large intestine before it becomes the rectum.
http://purl.obolibrary.org/obo/UBERON_0001159,sigmoid colon,http://purl.obolibrary.org/obo/UBERON_0000064,organ part,,"The part of the large intestine that is closest to the rectum and anus. It forms a loop that averages about 40 cm. in length, and normally lies within the pelvis, but on account of its freedom of movement it is liable to be displaced into the abdominal cavity."
http://purl.obolibrary.org/obo/UBERON_0001255,urinary bladder,http://purl.obolibrary.org/obo/UBERON_0000465,material anatomical entity,,distensible musculomembranous organ situated in the anterior part of the pelvic cavity in which urine collects before excretion[MP].
http://purl.obolibrary.org/obo/UBERON_0001323,tibial nerve,http://purl.obolibrary.org/obo/UBERON_0000477,anatomical cluster,,"The tibial nerve is a branch of the sciatic nerve. The tibial nerve passes through the popliteal fossa to pass below the arch of soleus. In the popliteal fossa the nerve gives off branches to gastrocnemius, popliteus, soleus and plantaris muscles, an articular branch to the knee joint, and a cutaneous branch that will become the sural nerve. The sural nerve is joined by fibres from the common peroneal nerve and runs down the calf to supply the lateral side of the foot. Below the soleus muscle the nerve lies close to the tibia and supplies the tibialis posterior, the flexor digitorum longus and the flexor hallucis longus. The nerve passes into the foot running posterior to the medial malleolus. Here it is bound down by the flexor retinaculum in company with the posterior tibial artery. [WP,unvetted]."
http://purl.obolibrary.org/obo/UBERON_0001723,tongue,http://purl.obolibrary.org/obo/UBERON_0000465,material anatomical entity,,A muscular organ in the floor of the mouth.
http://purl.obolibrary.org/obo/UBERON_0002046,thyroid gland,http://purl.obolibrary.org/obo/UBERON_0000465,material anatomical entity,,"A two-lobed endocrine gland found in all vertebrates, located in front of and on either side of the trachea in humans, and producing various hormones, such as triiodothyronine and calcitonin[BTO]."
http://purl.obolibrary.org/obo/UBERON_0002048,lung,http://purl.obolibrary.org/obo/UBERON_0000465,material anatomical entity,,Respiration organ that develops as an outpocketing of the esophagus.
http://purl.obolibrary.org/obo/UBERON_0002106,spleen,http://purl.obolibrary.org/obo/UBERON_0000465,material anatomical entity,,the organ that functions to filter blood and to store red corpuscles and platelets
http://purl.obolibrary.org/obo/UBERON_0002107,liver,http://purl.obolibrary.org/obo/UBERON_0000465,material anatomical entity,,"An exocrine gland which secretes bile and functions in metabolism of protein and carbohydrate and fat, synthesizes substances involved in the clotting of the blood, synthesizes vitamin A, detoxifies poisonous substances, stores glycogen, and breaks down worn-out erythrocytes[GO]."
http://purl.obolibrary.org/obo/UBERON_0002113,kidney,http://purl.obolibrary.org/obo/UBERON_0000465,material anatomical entity,,A paired organ of the urinary tract which has the production of urine as its primary function.
http://purl.obolibrary.org/obo/UBERON_0002116,ileum,http://purl.obolibrary.org/obo/UBERON_0000064,organ part,,the portion of the small intestine that extends from the jejunum to the colon
http://purl.obolibrary.org/obo/UBERON_0002358,peritoneum,http://purl.obolibrary.org/obo/UBERON_0000064,organ part,,"A serous membrane that lines the peritoneal cavity[VHOG,modified]."
http://purl.obolibrary.org/obo/UBERON_0002367,prostate gland,http://purl.obolibrary.org/obo/UBERON_0000465,material anatomical entity,,"The prostate gland is a partly muscular, partly glandular body that is situated near the base of the mammalian male urethra and secretes an alkaline viscid fluid which is a major constituent of the ejaculatory fluid."
http://purl.obolibrary.org/obo/OBI_0002460,defined population inclusion criterion,http://purl.obolibrary.org/obo/OBI_0500027,inclusion criterion,,An inclusion criterion that is based on fitting within the defined characteristics of a population based study design.
http://purl.obolibrary.org/obo/CHEBI_16670,peptide,http://purl.obolibrary.org/obo/CHEBI_33839,macromolecule,,"Amide derived from two or more amino carboxylic acid molecules (the same or different) by formation of a covalent bond from the carbonyl carbon of one to the nitrogen atom of another with formal loss of water. The term is usually applied to structures formed from alpha-amino acids, but it includes those derived from any amino carboxylic acid. X = OH, OR, NH2, NHR, etc."
http://purl.obolibrary.org/obo/CHEBI_33281,antimicrobial agent,http://purl.obolibrary.org/obo/OBIB_0000026,medication role,,"A substance that kills or slows the growth of microorganisms, including bacteria, viruses, fungi and protozoans."
http://purl.obolibrary.org/obo/CHEBI_35717,sedative,http://purl.obolibrary.org/obo/OBIB_0000026,medication role,,A central nervous system depressant used to induce drowsiness or sleep or to reduce psychological excitement or anxiety.
http://purl.obolibrary.org/obo/CHEBI_33697,ribonucleic acid,http://purl.obolibrary.org/obo/CHEBI_33696,nucleic acid,,"High molecular weight, linear polymers, composed of nucleotides containing ribose and linked by phosphodiester bonds; RNA is central to the synthesis of proteins."
http://purl.obolibrary.org/obo/CHEBI_50913,fixative,http://purl.obolibrary.org/obo/BFO_0000023,role,,"Any compound used for the purpose of preserving biological tissues from decay in such a way as to allow for the preparation of thin, stained sections for subsequent histological study."
http://purl.obolibrary.org/obo/CHEBI_65265,antacid,http://purl.obolibrary.org/obo/OBIB_0000026,medication role,,Any substance which is used to neutralise stomach acidity.
http://purl.obolibrary.org/obo/UBERON_0000173,amniotic fluid,http://purl.obolibrary.org/obo/UBERON_0000463,organism substance,,"Amniotic fluid is a bodily fluid consisting of watery liquid surrounding and cushioning a growing fetus within the amnion. It allows the fetus to move freely without the walls of the uterus being too tight against its body. Buoyancy is also provided. The composition of the fluid changes over the course of gestation. Initially, amniotic fluid is similar to maternal plasma, mainly water with electrolytes. As the fetus develops, proteins, carbohydrates, lipids, phospholipids originating from the lungs, fetal cells, and urea are deposited in the fluid."
http://purl.obolibrary.org/obo/UBERON_0000316,cervical mucus,http://purl.obolibrary.org/obo/UBERON_0006314,bodily fluid,,A substance produced by the cervix and endocervical glands[BTO]. Thick acidic mucus that blocks the cervical os after mestruation[WP]. This 'infertile' mucus blocks spermatozoa from entering the uterus.
http://purl.obolibrary.org/obo/UBERON_0000341,throat,http://purl.obolibrary.org/obo/UBERON_0000465,material anatomical entity,,"In anatomy, the throat is the anterior part of the neck, in front of the vertebral column. It consists of the pharynx and larynx. An important feature of the throat is the epiglottis, a flap which separates the esophagus from the trachea and prevents inhalation of food or drink. The throat contains various blood vessels, various pharyngeal muscles, the trachea (windpipe) and the esophagus. The hyoid bone and the clavicle are the only bones located in the throat of mammals. It is sometimes considered a synonym for fauces. [WP,unvetted]."
http://purl.obolibrary.org/obo/UBERON_0000362,renal medulla,http://purl.obolibrary.org/obo/UBERON_0000481,multi-tissue structure,,the inner portion of the kidney consisting of the renal pyramids
http://purl.obolibrary.org/obo/UBERON_0000463,organism substance,http://purl.obolibrary.org/obo/UBERON_0000465,material anatomical entity,,"Material anatomical entity in a gaseous, liquid, semisolid or solid state; produced by anatomical structures or derived from inhaled and ingested substances that have been modified by anatomical structures as they pass through the body."
http://purl.obolibrary.org/obo/UBERON_0000465,material anatomical entity,http://purl.obolibrary.org/obo/BFO_0000040,material entity,,Anatomical entity that has mass.
http://purl.obolibrary.org/obo/UBERON_0000477,anatomical cluster,http://purl.obolibrary.org/obo/BFO_0000040,material entity,,Anatomical group that has its parts adjacent to one another.
