http://purl.obolibrary.org/obo/OBI_0001936,molecular-labeled material,http://purl.obolibrary.org/obo/OBI_0000047,processed material,,a material entity that is the specified output of an addition of molecular label process that aims to label some molecular target to allow for its detection in a detection of molecular label assay
http://purl.obolibrary.org/obo/OBI_0002001,specimen integrity,http://purl.obolibrary.org/obo/PATO_0001442,wholeness,,A wholeness that inheres in a specimen.
http://purl.obolibrary.org/obo/OBI_0002002,specimen weight,http://purl.obolibrary.org/obo/IAO_0000414,mass measurement datum,,A mass measurement datum that is the result of an assay to measure the weight of a specimen.
http://purl.obolibrary.org/obo/OBI_0002003,specimen slide ID,http://purl.obolibrary.org/obo/IAO_0020000,identifier,,An identifier that specifically identifies a particular specimen slide.
http://purl.obolibrary.org/obo/OBI_0002004,surgical cancer treatment,http://purl.obolibrary.org/obo/NCIT_C16212,Cancer Therapeutic Procedure,,A  cancer therapeutic procedure that involves a surgical procedure as a main part.
http://purl.obolibrary.org/obo/OBI_0002005,specimen gross appearance of metastatic tumor,http://purl.obolibrary.org/obo/OBIB_0000209,specimen gross appearance of tumor,,"A specimen gross appearance of a tumor that has spread from its original site by discontinuous (not direct) spread, e.g. by blood or lymphatics."
http://purl.obolibrary.org/obo/OBI_0002006,specimen gross appearance of tumor center,http://purl.obolibrary.org/obo/OBIB_0000209,specimen gross appearance of tumor,,A specimen gross appearance of the most internal topographic location of the tumor.
http://purl.obolibrary.org/obo/OBI_0002007,specimen gross appearance of tumor edge,http://purl.obolibrary.org/obo/OBIB_0000209,specimen gross appearance of tumor,,A specimen gross appearance of the border of the tumor with non-tumorous tissue.
http://purl.obolibrary.org/obo/OBI_0002008,research authorization for post mortem specimen donation for a specific tissue or fluid,http://purl.obolibrary.org/obo/OBIB_0000459,research authorization documentation for post mortem specimen donation,,A research authorization documentation for postmortem specimen donation in which the authorization is for a specified tissue or biological fluid.
http://purl.obolibrary.org/obo/OBI_0002013,tissue specimen suitability for molecular analysis,http://purl.obolibrary.org/obo/IAO_0000144,conclusion textual entity,,A conclusion textual entity that signifies whether a specimen is acceptable for molecular analysis based on the assessment by a pathologist of a tissue specimen based on qualities such as purity and size.
http://purl.obolibrary.org/obo/OBI_0002076,collection of specimens,http://purl.obolibrary.org/obo/BFO_0000040,material entity,,A material entity that has two or more specimens as its parts.
http://purl.obolibrary.org/obo/OBI_0002087,containing a specimen function,http://purl.obolibrary.org/obo/OBI_0000370,contain function,,A contain function that involves physical contact with a specimen. This function is typically performed in such a way that the specimen is usable for an investigation or assay.
http://purl.obolibrary.org/obo/OBI_0002088,specimen container,http://purl.obolibrary.org/obo/OBI_0000967,container,,A container with the function of containing a specimen.
http://purl.obolibrary.org/obo/OBI_0002089,physical store,http://purl.obolibrary.org/obo/OBI_0001034,environmental control device,,A container with an environmental control function.
http://purl.obolibrary.org/obo/OBI_0002095,specimen family creation,http://purl.obolibrary.org/obo/OBI_0000094,material processing,,A material processing that has as its input a specimen and as its output a collection of specimens.
http://purl.obolibrary.org/obo/OBI_0002500,amniotic fluid specimen,http://purl.obolibrary.org/obo/OBI_0001479,specimen from organism,,A specimen that is derived from amniotic fluid.
http://purl.obolibrary.org/obo/OBI_0002501,bile specimen,http://purl.obolibrary.org/obo/OBI_2000009,bodily fluid specimen,,A specimen that is derived from bile.
http://purl.obolibrary.org/obo/OBI_0002502,cerebrospinal fluid specimen,http://purl.obolibrary.org/obo/OBI_2000009,bodily fluid specimen,,A specimen that is derived from cerbrospinal fluid.
http://purl.obolibrary.org/obo/OBI_0002505,milk specimen,http://purl.obolibrary.org/obo/OBI_2000009,bodily fluid specimen,,A specimen that is derived from milk.
http://purl.obolibrary.org/obo/OBI_0002506,pericardial fluid specimen,http://purl.obolibrary.org/obo/OBI_2000009,bodily fluid specimen,,A specimen that is derived from pericardial fluid.
http://purl.obolibrary.org/obo/OBI_0002507,saliva specimen,http://purl.obolibrary.org/obo/OBI_0001479,specimen from organism,,A specimen that is derived from saliva.
http://purl.obolibrary.org/obo/OBI_0002508,sputum specimen,http://purl.obolibrary.org/obo/OBI_0001479,specimen from organism,,A specimen that is derived from sputum.
http://purl.obolibrary.org/obo/OBI_0002509,sweat specimen,http://purl.obolibrary.org/obo/OBI_2000009,bodily fluid specimen,,A specimen that is derived from sweat.
http://purl.obolibrary.org/obo/OBI_0002510,synovial fluid specimen,http://purl.obolibrary.org/obo/OBI_2000009,bodily fluid specimen,,A specimen that is derived from synovial fluid.
http://purl.obolibrary.org/obo/OBI_0002512,bone marrow specimen,http://purl.obolibrary.org/obo/OBI_0001479,specimen from organism,,A specimen that is derived from bone marrow.
http://purl.obolibrary.org/obo/OBI_0002513,placenta specimen,http://purl.obolibrary.org/obo/OBI_0001479,specimen from organism,,A specimen that is derived from placenta.
http://purl.obolibrary.org/obo/OBI_0002514,peritoneal fluid specimen,http://purl.obolibrary.org/obo/OBI_2000009,bodily fluid specimen,,A specimen that is derived from peritoneal fluid.
http://purl.obolibrary.org/obo/OBI_0002515,pleural fluid specimen,http://purl.obolibrary.org/obo/OBI_2000009,bodily fluid specimen,,A specimen that is derived from pleural fluid.
http://purl.obolibrary.org/obo/OBI_0002516,brain specimen,http://purl.obolibrary.org/obo/OBI_0001479,specimen from organism,,A specimen that is derived from brain.
http://purl.obolibrary.org/obo/OBI_0002517,hair specimen,http://purl.obolibrary.org/obo/OBI_0001479,specimen from organism,,A specimen that is derived from hair.
http://purl.obolibrary.org/obo/OBI_0002518,prostate gland specimen,http://purl.obolibrary.org/obo/OBI_0001479,specimen from organism,,A specimen that is derived from prostate gland.
http://purl.obolibrary.org/obo/OBI_0002519,skeletal muscle tissue specimen,http://purl.obolibrary.org/obo/OBI_0001479,specimen from organism,,A specimen that is derived from skeletal muscle.
http://purl.obolibrary.org/obo/OBI_0002520,heart specimen,http://purl.obolibrary.org/obo/OBI_0001479,specimen from organism,,A specimen that is derived from heart.
http://purl.obolibrary.org/obo/OBI_0002522,adrenal gland specimen,http://purl.obolibrary.org/obo/OBI_0001479,specimen from organism,,A specimen that is derived from adrenal gland.
http://purl.obolibrary.org/obo/OBI_0002524,urinary bladder specimen,http://purl.obolibrary.org/obo/OBI_0001479,specimen from organism,,A specimen that is derived from urinary bladder.
http://purl.obolibrary.org/obo/OBI_0002525,tibial artery specimen,http://purl.obolibrary.org/obo/OBI_0001479,specimen from organism,,A specimen that is derived from tibial artery.
http://purl.obolibrary.org/obo/OBI_0002527,pancreas specimen,http://purl.obolibrary.org/obo/OBI_0001479,specimen from organism,,A specimen that is derived from pancreas.
http://purl.obolibrary.org/obo/OBI_0002528,stomach specimen,http://purl.obolibrary.org/obo/OBI_0001479,specimen from organism,,A specimen that is derived from stomach.
http://purl.obolibrary.org/obo/OBI_0002529,pituitary gland specimen,http://purl.obolibrary.org/obo/OBI_0001479,specimen from organism,,A specimen that is derived from pituitary gland.
http://purl.obolibrary.org/obo/OBI_0002530,adipose tissue specimen,http://purl.obolibrary.org/obo/OBI_0001479,specimen from organism,,A specimen that is derived from adipose tissue.
http://purl.obolibrary.org/obo/OBI_0002532,esophagus mucosa specimen,http://purl.obolibrary.org/obo/OBI_0001479,specimen from organism,,A specimen that is derived from esophagus mucosa.
http://purl.obolibrary.org/obo/OBI_0002533,colon specimen,http://purl.obolibrary.org/obo/OBI_0001479,specimen from organism,,A specimen that is derived from colon.
http://purl.obolibrary.org/obo/OBI_0002534,lung specimen,http://purl.obolibrary.org/obo/OBI_0001479,specimen from organism,,A specimen that is derived from lung.
http://purl.obolibrary.org/obo/OBI_0002537,thyroid gland specimen,http://purl.obolibrary.org/obo/OBI_0001479,specimen from organism,,A specimen that is derived from thyroid gland.
http://purl.obolibrary.org/obo/OBI_0002539,tibial nerve specimen,http://purl.obolibrary.org/obo/OBI_0001479,specimen from organism,,A specimen that is derived from tibial nerve.
http://purl.obolibrary.org/obo/OBI_0002540,coronary artery specimen,http://purl.obolibrary.org/obo/OBI_0001479,specimen from organism,,A specimen that is derived from coronary artery.
http://purl.obolibrary.org/obo/OBI_0002541,spleen specimen,http://purl.obolibrary.org/obo/OBI_0001479,specimen from organism,,A specimen that is derived from spleen.
http://purl.obolibrary.org/obo/OBI_0002542,aorta specimen,http://purl.obolibrary.org/obo/OBI_0001479,specimen from organism,,A specimen that is derived from aorta.
http://purl.obolibrary.org/obo/OBI_0100017,blood serum specimen,http://purl.obolibrary.org/obo/OBI_0000953,processed specimen,,A material entity which derives from blood and corresponds to blood plasma without fibrinogen or the other clotting factors.
http://purl.obolibrary.org/obo/OBI_0100026,organism,http://purl.obolibrary.org/obo/BFO_0000040,material entity,,"A material entity that is an individual living system, such as animal, plant, bacteria or virus, that is capable of replicating or reproducing, growth and maintenance in the right environment. An organism may be unicellular or made up, like humans, of many billions of cells divided into specialized tissues and organs."
http://purl.obolibrary.org/obo/OBI_0100051,specimen,http://purl.obolibrary.org/obo/BFO_0000040,material entity,,A material entity that has the specimen role.
http://purl.obolibrary.org/obo/OBI_0200166,data transformation objective,http://purl.obolibrary.org/obo/IAO_0000005,objective specification,,An objective specification to transformation input data into output data
http://purl.obolibrary.org/obo/OBI_0200170,averaging data transformation,http://purl.obolibrary.org/obo/OBI_0200000,data transformation,,An averaging data transformation is a data transformation that has objective averaging.
http://purl.obolibrary.org/obo/OBI_0302716,pool of specimens,http://purl.obolibrary.org/obo/OBI_0000953,processed specimen,,"A pool of specimens is a mixture of a population of samples which have been gathered from one or more sample populations, obtained by the physical process of mixing individual specimens, e.g.  mixing the DNA collected from the individual fish."
http://purl.obolibrary.org/obo/OBI_0302874,edited document,http://purl.obolibrary.org/obo/IAO_0000310,document,,A document which is the output of a document editing process
http://purl.obolibrary.org/obo/OBI_0302884,extraction,http://purl.obolibrary.org/obo/OBI_0600014,material component separation,,A material separation in which a desired component of an input material is separated from the remainder
http://purl.obolibrary.org/obo/OBI_0302885,filtration,http://purl.obolibrary.org/obo/OBI_0600014,material component separation,,filtration is a process which separates components suspended in a fluid based on granularity properties relying on a filter device
http://purl.obolibrary.org/obo/OBI_0302886,centrifugation,http://purl.obolibrary.org/obo/OBI_0600014,material component separation,,centrifugation is a process separating molecules by size or density using centrifugal forces generated by a spinning rotor. G-forces of several hundred thousand times gravity are generated in ultracentrifugation
http://purl.obolibrary.org/obo/OBI_0302887,staining,http://purl.obolibrary.org/obo/OBI_0000094,material processing,,"Staining is a process which results in the addition a class-specific (DNA, proteins, lipids, carbohydrates) dye to a substrate to qualify or quantify the presence of a specific compound."
http://purl.obolibrary.org/obo/OBI_0302893,storage,http://purl.obolibrary.org/obo/OBI_0000838,material maintenance,,A maintenance process by which material entities that are not actively metabolizing are placed in well identified location and possibly under controlled environment in ad-hoc devices/structures in order to preserve and protect them from decay/alteration and maintain availability
http://purl.obolibrary.org/obo/OBI_0302908,document editing,http://purl.obolibrary.org/obo/OBI_0000011,planned process,,is a planned process with specified input original document and specified output edited document
http://purl.obolibrary.org/obo/OBI_0302914,digital curation,http://purl.obolibrary.org/obo/IAO_0000572,documenting,,"Digital curation is the process of establishing and developing long term repositories of digital assets for current and future reference by researchers, scientists, and historians, and scholars generally."
http://purl.obolibrary.org/obo/OBI_0400106,centrifuge,http://purl.obolibrary.org/obo/OBI_0000932,material separation device,,A device with a rapidly rotating container that applies centrifugal force to its contents
http://purl.obolibrary.org/obo/OBI_0400168,microtome,http://purl.obolibrary.org/obo/OBI_0000932,material separation device,,"A microtome is a mechanical instrument used to cut biological specimens into very thin segments for further treatment (e.g. ISH) and ultimately microscopic or histologic examination. Most microtomes provide cooling facilities (cryo-microtome) and use a steel blade to cut a slice of defined thickness. Some are automatic, and some are driven by hand."
http://purl.obolibrary.org/obo/OBI_0500028,exclusion criterion,http://purl.obolibrary.org/obo/OBI_0500026,eligibility criterion,,"an exclusion criterion (rule) is_a *eligibility criterion*  which defines and states a condition which, if met, makes an entity unsuitable for a given task or participation in a given process. For instance, in a study protocol, exclusion criteria indicate the conditions that prospective subjects SHOULD NOT meet to be eligible for participation in a study"
http://purl.obolibrary.org/obo/OBI_0600004,human subject enrollment,http://purl.obolibrary.org/obo/OBI_0001928,selection,,A planned process with the objective to obtain a population of human subjects to participate in an investigation by determining eligibility of subjects and obtaining informed consent.
http://purl.obolibrary.org/obo/OBI_0600005,collecting specimen from organism,http://purl.obolibrary.org/obo/OBI_0000659,specimen collection process,,a process with the objective to obtain a material entity that was part of an organism for potential future use in an investigation
http://purl.obolibrary.org/obo/OBI_0600014,material component separation,http://purl.obolibrary.org/obo/OBI_0000094,material processing,,a material processing in which components of an input material become segregated in space
http://purl.obolibrary.org/obo/OBI_0600024,maintaining cell culture,http://purl.obolibrary.org/obo/OBI_0000838,material maintenance,,a protocol application in which cells are kept alive in a defined environment outside of an organism.  part of cell_culturing
http://purl.obolibrary.org/obo/OBI_0600036,establishing cell culture,http://purl.obolibrary.org/obo/OBI_0000094,material processing,,"a process through which a new type of cell culture or cell line is created, either through the isolation and culture of one or more cells from a fresh source, or the deliberate experimental modification of an existing cell culture (e.g passaging a primary culture to become a secondary culture or line, or the immortalization or stable genetic modification of an existing culture or line)."
http://purl.obolibrary.org/obo/OBI_0600044,lavage,http://purl.obolibrary.org/obo/OBI_0600014,material component separation,,A protocol application to separate cells and/or cellular secretions from an anatomical space by the introduction and removal of fluid
http://purl.obolibrary.org/obo/OBI_0600052,dialysis,http://purl.obolibrary.org/obo/OBI_0600014,material component separation,,a protocol application that uses diffusion through a semi-permeable membrane to separate an input material into two fractions of different composition
http://purl.obolibrary.org/obo/OBI_0666666,RNA extraction,http://purl.obolibrary.org/obo/OBI_0666667,nucleic acid extraction,,A RNA extraction is a nucleic acid extraction where the desired output material is RNA
http://purl.obolibrary.org/obo/OBI_0666667,nucleic acid extraction,http://purl.obolibrary.org/obo/OBI_0302884,extraction,,a material separation to recover the nucleic acid fraction of an input material
http://purl.obolibrary.org/obo/OBI_1000024,cell pellet,http://purl.obolibrary.org/obo/OBI_0000047,processed material,,A material entity which results from the aggregation of cells produced by the application of centrifugal force to a liquid containing cells in suspension
http://purl.obolibrary.org/obo/OBI_1110109,target of material addition,http://purl.obolibrary.org/obo/BFO_0000040,material entity,,A material entity into which another is being added in a material combinatino process
http://purl.obolibrary.org/obo/OGMS_0000015,clinical history,http://purl.obolibrary.org/obo/IAO_0000030,information content entity,,A series of statements representing health-relevant qualities of a patient and of a patient's family.
http://purl.obolibrary.org/obo/OGMS_0000023,phenotype,http://purl.obolibrary.org/obo/BFO_0000019,quality,,A (combination of) quality(ies) of an organism determined by the interaction of its genetic make-up and environment that differentiates specific instances of a species from other instances of the same species.
http://purl.obolibrary.org/obo/OGMS_0000031,disease,http://purl.obolibrary.org/obo/BFO_0000016,disposition,,A disposition (i) to undergo pathological processes that (ii) exists in an organism because of one or more disorders in that organism.
http://purl.obolibrary.org/obo/OGMS_0000090,treatment,http://purl.obolibrary.org/obo/OBI_0000011,planned process,,"A planned process whose completion is hypothesized by a health care provider to eliminate, prevent, or alleviate a disorder, the signs and symptoms of a disorder, or a pathological process"
http://purl.obolibrary.org/obo/PATO_0000011,age,http://purl.obolibrary.org/obo/PATO_0000165,time,,A time quality inhering in a bearer by virtue of how long the bearer has existed.
http://purl.obolibrary.org/obo/PATO_0000047,biological sex,http://purl.obolibrary.org/obo/PATO_0001995,organismal quality,,An organismal quality inhering in a bearer by virtue of the bearer's ability to undergo sexual reproduction in order to differentiate the individuals or types involved.
http://purl.obolibrary.org/obo/PATO_0000122,length,http://purl.obolibrary.org/obo/PATO_0000051,morphology,,A 1-D extent quality which is equal to the distance between two points.
http://purl.obolibrary.org/obo/PATO_0000125,mass,http://purl.obolibrary.org/obo/PATO_0001018,physical quality,,A physical quality that inheres in a bearer by virtue of the proportion of the bearer's amount of matter.
http://purl.obolibrary.org/obo/PATO_0000146,temperature,http://purl.obolibrary.org/obo/PATO_0001018,physical quality,,A physical quality of the thermal energy of a system.
http://purl.obolibrary.org/obo/PATO_0000918,volume,http://purl.obolibrary.org/obo/PATO_0001710,3-D extent,,A 3-D extent quality inhering in a bearer by virtue of the bearer's amount of 3-dimensional space it occupies.
http://purl.obolibrary.org/obo/PATO_0001421,alive,http://purl.obolibrary.org/obo/PATO_0000169,viability,,A viability quality inhering in a bearer by virtue of the bearer's condition before death.
http://purl.obolibrary.org/obo/PATO_0001422,dead,http://purl.obolibrary.org/obo/PATO_0000169,viability,,A viability quality inhering in a bearer by virtue of the cessation of the bearer's life.
http://purl.obolibrary.org/obo/PATO_0001985,frozen,http://purl.obolibrary.org/obo/PATO_0000146,temperature,,A quality inhering in a bearer by virtue of the bearer's being kept below its freezing point.
http://purl.obolibrary.org/obo/PATO_0001995,organismal quality,http://purl.obolibrary.org/obo/PATO_0001241,physical object quality,,A quality that inheres in an entire organism or part of an organism.
http://purl.obolibrary.org/obo/UO_0000001,length unit,http://purl.obolibrary.org/obo/IAO_0000003,measurement unit label,,A unit which is a standard measure of the distance between two points.
http://purl.obolibrary.org/obo/UO_0000002,mass unit,http://purl.obolibrary.org/obo/IAO_0000003,measurement unit label,,A unit which is a standard measure of the amount of matter/energy of a physical object.
http://purl.obolibrary.org/obo/UO_0000003,time unit,http://purl.obolibrary.org/obo/IAO_0000003,measurement unit label,,A unit which is a standard measure of the dimension in which events occur in sequence.
http://purl.obolibrary.org/obo/APOLLO_SV_00000032,count,http://purl.obolibrary.org/obo/IAO_0000109,measurement datum,,A measurement datum that is the output of counting.
http://purl.obolibrary.org/obo/APOLLO_SV_00000085,age data by age brackets,http://purl.obolibrary.org/obo/IAO_0000100,data set,,A data set consisting of measurements of age organized in age brackets.
http://purl.obolibrary.org/obo/IAO_0020010,dubbing process,http://purl.obolibrary.org/obo/OBI_0000011,planned process,,A dubbing process is a planned process that provides a reference to an individual entity shared by a group of subscribers to refer to that individual entity.
http://purl.obolibrary.org/obo/IAO_0020015,personal name,http://purl.obolibrary.org/obo/IAO_0020000,identifier,,A personal name is a proper name identifying an individual person.
http://purl.obolibrary.org/obo/ICO_0000023,completely filled informed consent form,http://purl.obolibrary.org/obo/ICO_0000001,informed consent form,,An informed consent form that has been filled with all required contents.
http://purl.obolibrary.org/obo/ICO_0000024,partially filled informed consent form,http://purl.obolibrary.org/obo/ICO_0000001,informed consent form,,An informed consent form that has been partially filled with required contents.
http://purl.obolibrary.org/obo/OBIB_0000010,freezer shelf,http://purl.obolibrary.org/obo/OBI_0000968,device,,A device that is part of a freezer and consists of a solid horizontal surface to keep material in the freezer on a flat surface.
http://purl.obolibrary.org/obo/OBIB_0000011,discarding,http://purl.obolibrary.org/obo/OBI_0000011,planned process,,A planned process that gets rid of a material that is no longer useful or desirable.
http://purl.obolibrary.org/obo/OBIB_0000012,human subject recuiter role,http://purl.obolibrary.org/obo/OBI_0000116,worker role,,A worker role of recruiting human subjects to partcipate in a clinical investigation in which data about human subject is collected.
http://purl.obolibrary.org/obo/OBIB_0000013,cryovial box,http://purl.obolibrary.org/obo/OBI_0000967,container,,A device that is intended to hold cryovials.
http://purl.obolibrary.org/obo/OBIB_0000014,trash container,http://purl.obolibrary.org/obo/OBI_0000967,container,,A container that is used for discarded material.
http://purl.obolibrary.org/obo/OBIB_0000015,freezer rack,http://purl.obolibrary.org/obo/OBI_0000968,device,,A device that is part of a freezer for keeping material in the freezer in a defined position and prevents movement.
http://purl.obolibrary.org/obo/OBIB_0000016,blood spot card box,http://purl.obolibrary.org/obo/OBI_0000967,container,,A device that is designed to contain blood spot cards.
http://purl.obolibrary.org/obo/OBIB_0000017,data confirm questionnaire,http://purl.obolibrary.org/obo/OBI_0001000,questionnaire,,"A questionnaire that comprises a set of questions about patient, such as height, weight, race, biological sex, clinical history, etc., which will be filled by a recruiter based on an Electronic Medical Record (EMR)."
http://purl.obolibrary.org/obo/OBIB_0000018,form filling,http://purl.obolibrary.org/obo/OBI_0302908,document editing,,"A document editing process in which one or more fields in a form are filled with related information, such as when answering a questionnare."
http://purl.obolibrary.org/obo/OBIB_0000019,filled patient questionnaire,http://purl.obolibrary.org/obo/OBIB_0000020,patient questionnaire,,A patient questionnaire which has been filled out by a patient.
http://purl.obolibrary.org/obo/OBIB_0000020,patient questionnaire,http://purl.obolibrary.org/obo/OBI_0001000,questionnaire,,A questionnaire that comprises a set of demographic and medical questions about a patient which will be filled by the patient or their legally authorized representative.
http://purl.obolibrary.org/obo/OBIB_0000021,collection packet with specimen and information material,http://purl.obolibrary.org/obo/OBIB_0000024,collection packet with specimen,,A collection packet which contains a container with a specimen and a form filled with information about the collected specimen and specimen source.
http://purl.obolibrary.org/obo/OBIB_0000022,blood additive role,http://purl.obolibrary.org/obo/OBI_0000319,material to be added role,,A material to be added role that is born by a chemical entity which is added into a blood collection containter to optimize specific blood component(s) preservation and/or separation.
